{
  "$schema": "https://json-schema.org/draft/2020-12/schema",
  "$id": "https://github.com/Seeed-Projects/reterminal-sticky-playground-registry/blob/main/schemas/firmware.schema.json",
  "title": "reTerminal Sticky Playground firmware",
  "description": "Declarative metadata for one official, partner, or community firmware in the reTerminal Sticky Playground registry.",
  "type": "object",
  "additionalProperties": false,
  "required": [
    "schemaVersion",
    "id",
    "name",
    "group",
    "catalogSection",
    "mode",
    "status",
    "summary",
    "description",
    "source",
    "support",
    "compatibility",
    "assets"
  ],
  "properties": {
    "schemaVersion": {
      "type": "integer",
      "const": 1
    },
    "id": {
      "type": "string",
      "pattern": "^[a-z0-9]+(?:-[a-z0-9]+)*$",
      "minLength": 2,
      "maxLength": 64
    },
    "name": {
      "type": "string",
      "minLength": 1,
      "maxLength": 80
    },
    "group": {
      "type": "string",
      "enum": [
        "official",
        "partner",
        "community"
      ]
    },
    "catalogSection": {
      "type": "string",
      "enum": [
        "official",
        "platform",
        "community",
        "draft"
      ]
    },
    "category": {
      "type": "string",
      "description": "Fixed category used by the Community Firmwares filter on the Sticky Playground.",
      "enum": [
        "ereader",
        "productivity",
        "writing",
        "personal",
        "health",
        "weather",
        "finance",
        "tools",
        "fun",
        "smart-home",
        "other"
      ]
    },
    "mode": {
      "type": "string",
      "enum": [
        "external",
        "template",
        "download",
        "flash"
      ]
    },
    "status": {
      "type": "string",
      "enum": [
        "experimental",
        "beta",
        "stable"
      ]
    },
    "summary": {
      "type": "string",
      "minLength": 1,
      "maxLength": 140
    },
    "description": {
      "type": "string",
      "minLength": 1,
      "maxLength": 800
    },
    "author": {
      "$ref": "#/$defs/attribution"
    },
    "origin": {
      "$ref": "#/$defs/attribution"
    },
    "source": {
      "type": "object",
      "additionalProperties": false,
      "required": [
        "url"
      ],
      "properties": {
        "url": {
          "$ref": "#/$defs/httpsUrl"
        },
        "license": {
          "type": "string",
          "minLength": 1,
          "maxLength": 80
        },
        "path": {
          "$ref": "#/$defs/localPath"
        }
      }
    },
    "support": {
      "type": "object",
      "additionalProperties": false,
      "required": [
        "url"
      ],
      "properties": {
        "url": {
          "$ref": "#/$defs/httpsUrl"
        }
      }
    },
    "documentationUrl": {
      "$ref": "#/$defs/httpsUrl"
    },
    "compatibility": {
      "type": "object",
      "additionalProperties": false,
      "required": [
        "devices"
      ],
      "properties": {
        "devices": {
          "type": "array",
          "minItems": 1,
          "maxItems": 1,
          "uniqueItems": true,
          "items": {
            "const": "reterminal-sticky"
          }
        },
        "notes": {
          "type": "string",
          "maxLength": 400
        }
      }
    },
    "assets": {
      "type": "object",
      "additionalProperties": false,
      "required": [
        "preview",
        "previewAlt"
      ],
      "properties": {
        "logo": {
          "$ref": "#/$defs/assetPath"
        },
        "preview": {
          "$ref": "#/$defs/assetPath"
        },
        "previewAlt": {
          "type": "string",
          "minLength": 1,
          "maxLength": 180
        }
      }
    },
    "tags": {
      "type": "array",
      "maxItems": 6,
      "uniqueItems": true,
      "items": {
        "type": "string",
        "minLength": 1,
        "maxLength": 32
      }
    },
    "build": {
      "type": "object",
      "description": "Toolchain settings the Registry uses to build this firmware in CI.",
      "oneOf": [
        {
          "title": "ESP-IDF",
          "type": "object",
          "additionalProperties": false,
          "required": [
            "system",
            "version",
            "target",
            "projectPath"
          ],
          "properties": {
            "system": {
              "const": "esp-idf"
            },
            "version": {
              "type": "string",
              "description": "ESP-IDF Docker image tag used to build this firmware.",
              "pattern": "^[A-Za-z0-9][A-Za-z0-9._-]*$",
              "maxLength": 64
            },
            "target": {
              "type": "string",
              "pattern": "^[a-z0-9]+(?:-[a-z0-9]+)*$",
              "maxLength": 40
            },
            "projectPath": {
              "description": "Directory that contains CMakeLists.txt.",
              "$ref": "#/$defs/localPath"
            }
          }
        },
        {
          "title": "PlatformIO",
          "type": "object",
          "additionalProperties": false,
          "required": [
            "system",
            "environment",
            "projectPath"
          ],
          "properties": {
            "system": {
              "const": "platformio"
            },
            "environment": {
              "type": "string",
              "description": "platformio.ini environment name to build, without the \"env:\" prefix.",
              "pattern": "^[A-Za-z0-9][A-Za-z0-9._-]*$",
              "maxLength": 64
            },
            "projectPath": {
              "description": "Directory that contains platformio.ini.",
              "$ref": "#/$defs/localPath"
            }
          }
        },
        {
          "title": "Arduino",
          "type": "object",
          "additionalProperties": false,
          "required": [
            "system",
            "profile",
            "projectPath"
          ],
          "properties": {
            "system": {
              "const": "arduino"
            },
            "profile": {
              "type": "string",
              "description": "sketch.yaml profile name that pins the board core and libraries.",
              "pattern": "^[A-Za-z0-9][A-Za-z0-9._-]*$",
              "maxLength": 64
            },
            "projectPath": {
              "description": "Sketch directory that contains sketch.yaml.",
              "$ref": "#/$defs/localPath"
            }
          }
        }
      ]
    },
    "external": {
      "type": "object",
      "additionalProperties": false,
      "required": [
        "label",
        "url",
        "description"
      ],
      "properties": {
        "label": {
          "type": "string",
          "minLength": 1,
          "maxLength": 60
        },
        "url": {
          "$ref": "#/$defs/httpsUrl"
        },
        "description": {
          "type": "string",
          "minLength": 1,
          "maxLength": 400
        },
        "submission": {
          "type": "object",
          "additionalProperties": false,
          "required": ["hostingReason", "userFlow", "siteRequirements"],
          "properties": {
            "hostingReason": { "$ref": "#/$defs/submissionText" },
            "userFlow": { "$ref": "#/$defs/submissionText" },
            "siteRequirements": { "type": "string", "minLength": 1, "maxLength": 2000, "pattern": "\\S" }
          }
        }
      }
    },
    "template": {
      "type": "object",
      "additionalProperties": false,
      "required": [
        "outputExtension",
        "mimeType",
        "fileNamePattern",
        "options"
      ],
      "properties": {
        "outputExtension": {
          "type": "string",
          "pattern": "^[a-z0-9]+$",
          "maxLength": 12
        },
        "mimeType": {
          "type": "string",
          "pattern": "^[a-z0-9.+-]+/[a-z0-9.+-]+$",
          "maxLength": 80
        },
        "fileNamePattern": {
          "type": "string",
          "minLength": 1,
          "maxLength": 120
        },
        "headerPath": {
          "$ref": "#/$defs/localPath"
        },
        "footerPath": {
          "$ref": "#/$defs/localPath"
        },
        "options": {
          "type": "array",
          "minItems": 1,
          "items": {
            "$ref": "#/$defs/templateOption"
          }
        }
      }
    },
    "download": {
      "type": "object",
      "additionalProperties": false,
      "required": [
        "url",
        "steps"
      ],
      "properties": {
        "url": {
          "$ref": "#/$defs/httpsUrl"
        },
        "version": {
          "type": "string",
          "minLength": 1,
          "maxLength": 40
        },
        "fileName": {
          "type": "string",
          "minLength": 1,
          "maxLength": 120
        },
        "sha256": {
          "$ref": "#/$defs/sha256"
        },
        "steps": {
          "$ref": "#/$defs/instructions"
        }
      }
    },
    "flash": {
      "type": "object",
      "additionalProperties": false,
      "required": [
        "versions"
      ],
      "properties": {
        "versions": {
          "type": "array",
          "minItems": 1,
          "items": {
            "$ref": "#/$defs/flashVersion"
          }
        },
        "notes": {
          "$ref": "#/$defs/instructions"
        }
      }
    }
  },
  "allOf": [
    {
      "if": {
        "properties": {
          "group": {
            "const": "community"
          }
        }
      },
      "then": {
        "required": [
          "author"
        ]
      }
    },
    {
      "if": {
        "properties": {
          "group": {
            "const": "partner"
          }
        }
      },
      "then": {
        "properties": {
          "catalogSection": {
            "const": "platform"
          },
          "mode": {
            "const": "flash"
          }
        }
      }
    },
    {
      "if": {
        "properties": {
          "catalogSection": {
            "const": "community"
          }
        },
        "required": [
          "mode",
          "catalogSection"
        ]
      },
      "then": {
        "required": [
          "category"
        ],
        "properties": {
          "group": { "const": "community" },
          "mode": { "enum": ["flash", "external"] }
        }
      }
    },
    {
      "if": {
        "properties": {
          "catalogSection": { "const": "community" },
          "mode": { "const": "external" }
        },
        "required": ["catalogSection", "mode"]
      },
      "then": {
        "properties": {
          "external": { "required": ["submission"] },
          "source": { "not": { "required": ["path"] } }
        },
        "not": { "required": ["build"] }
      }
    },
    {
      "if": {
        "properties": {
          "mode": {
            "const": "external"
          }
        }
      },
      "then": {
        "required": [
          "external"
        ],
        "not": {
          "anyOf": [
            {
              "required": [
                "template"
              ]
            },
            {
              "required": [
                "download"
              ]
            },
            {
              "required": [
                "flash"
              ]
            }
          ]
        }
      }
    },
    {
      "if": {
        "properties": {
          "mode": {
            "const": "template"
          }
        }
      },
      "then": {
        "required": [
          "template"
        ],
        "not": {
          "anyOf": [
            {
              "required": [
                "external"
              ]
            },
            {
              "required": [
                "download"
              ]
            },
            {
              "required": [
                "flash"
              ]
            }
          ]
        }
      }
    },
    {
      "if": {
        "properties": {
          "mode": {
            "const": "download"
          }
        }
      },
      "then": {
        "required": [
          "download"
        ],
        "not": {
          "anyOf": [
            {
              "required": [
                "external"
              ]
            },
            {
              "required": [
                "template"
              ]
            },
            {
              "required": [
                "flash"
              ]
            }
          ]
        }
      }
    },
    {
      "if": {
        "properties": {
          "mode": {
            "const": "flash"
          }
        }
      },
      "then": {
        "required": [
          "flash"
        ],
        "not": {
          "anyOf": [
            {
              "required": [
                "external"
              ]
            },
            {
              "required": [
                "template"
              ]
            },
            {
              "required": [
                "download"
              ]
            }
          ]
        }
      }
    }
  ],
  "$defs": {
    "submissionText": {
      "type": "string",
      "minLength": 20,
      "maxLength": 2000,
      "pattern": "\\S"
    },
    "httpsUrl": {
      "type": "string",
      "format": "uri",
      "pattern": "^https://",
      "maxLength": 2048
    },
    "sha256": {
      "type": "string",
      "pattern": "^[a-f0-9]{64}$"
    },
    "localPath": {
      "type": "string",
      "pattern": "^(?!/)(?!.*(?:^|/)\\.\\.(?:/|$))[A-Za-z0-9._/-]+$",
      "minLength": 1,
      "maxLength": 240
    },
    "assetPath": {
      "type": "string",
      "pattern": "^assets/[A-Za-z0-9._/-]+\\.(?:png|jpe?g|webp|svg)$",
      "maxLength": 240
    },
    "attribution": {
      "type": "object",
      "additionalProperties": false,
      "required": [
        "name"
      ],
      "properties": {
        "name": {
          "type": "string",
          "minLength": 1,
          "maxLength": 80
        },
        "url": {
          "$ref": "#/$defs/httpsUrl"
        }
      }
    },
    "templateOption": {
      "type": "object",
      "additionalProperties": false,
      "required": [
        "id",
        "label",
        "description",
        "path"
      ],
      "properties": {
        "id": {
          "type": "string",
          "pattern": "^[a-z0-9]+(?:-[a-z0-9]+)*$",
          "maxLength": 64
        },
        "label": {
          "type": "string",
          "minLength": 1,
          "maxLength": 80
        },
        "description": {
          "type": "string",
          "minLength": 1,
          "maxLength": 300
        },
        "path": {
          "$ref": "#/$defs/localPath"
        },
        "required": {
          "type": "boolean",
          "default": false
        },
        "defaultSelected": {
          "type": "boolean",
          "default": false
        }
      }
    },
    "instruction": {
      "type": "object",
      "additionalProperties": false,
      "required": [
        "title",
        "description"
      ],
      "properties": {
        "title": {
          "type": "string",
          "minLength": 1,
          "maxLength": 100
        },
        "description": {
          "type": "string",
          "minLength": 1,
          "maxLength": 500
        }
      }
    },
    "instructions": {
      "type": "array",
      "minItems": 1,
      "maxItems": 12,
      "items": {
        "$ref": "#/$defs/instruction"
      }
    },
    "flashVersion": {
      "type": "object",
      "additionalProperties": false,
      "required": [
        "version",
        "channel"
      ],
      "properties": {
        "version": {
          "type": "string",
          "minLength": 1,
          "maxLength": 40
        },
        "channel": {
          "type": "string",
          "enum": [
            "experimental",
            "beta",
            "stable"
          ]
        },
        "manifestUrl": {
          "$ref": "#/$defs/httpsUrl"
        },
        "manifestSha256": {
          "$ref": "#/$defs/sha256"
        },
        "releaseUrl": {
          "$ref": "#/$defs/httpsUrl"
        },
        "manifestPath": {
          "$ref": "#/$defs/localPath"
        },
        "sourceBuild": {
          "type": "boolean",
          "const": true,
          "description": "Build and publish this version from the submitted source with GitHub Actions."
        }
      },
      "oneOf": [
        {
          "required": [
            "manifestPath"
          ]
        },
        {
          "required": [
            "manifestUrl",
            "manifestSha256",
            "releaseUrl"
          ]
        },
        {
          "required": [
            "sourceBuild"
          ]
        }
      ]
    }
  }
}
