{
  "schemaVersion": 1,
  "id": "reterminal-sticky-2048-eink-game",
  "name": "Sticky 2048",
  "group": "community",
  "catalogSection": "draft",
  "mode": "download",
  "status": "experimental",
  "summary": "A native ESP-IDF 2048 game demo running on reTerminal Sticky with E-Ink display and touch control.",
  "description": "A community 2048 game demo for reTerminal Sticky. The project uses native ESP-IDF development with a 1-bit E-Ink framebuffer, GT911 touch input, partial refresh optimization, battery status display, and hardware integration.",
  "author": {
    "name": "Lukilyy",
    "url": "https://github.com/Lukilyy"
  },
  "source": {
    "url": "https://github.com/Lukilyy/reterminal-sticky-2048-eink-game",
    "license": "MIT"
  },
  "support": {
    "url": "https://github.com/Lukilyy/reterminal-sticky-2048-eink-game/issues"
  },
  "documentationUrl": "https://github.com/Lukilyy/reterminal-sticky-2048-eink-game#readme",
  "compatibility": {
    "devices": [
      "reterminal-sticky"
    ],
    "notes": "Tested on Seeed Studio reTerminal Sticky with ESP32-S3 and E-Ink display."
  },
  "assets": {
    "logo": "assets/logo.svg",
    "preview": "assets/preview.jpg",
    "previewAlt": "reTerminal Sticky running 2048 E-Ink Game"
  },
  "tags": [
    "game",
    "eink",
    "esp32",
    "esp-idf"
  ],
  "download": {
    "url": "https://github.com/Lukilyy/reterminal-sticky-2048-eink-game/archive/refs/tags/v1.0.1.zip",
    "version": "1.0.1",
    "fileName": "reterminal-sticky-2048-eink-game-v1.0.1.zip",
    "steps": [
      {
        "title": "Download the project",
        "description": "Download and extract the ESP-IDF project archive."
      },
      {
        "title": "Build the firmware",
        "description": "Open the project with ESP-IDF v5.4 and build the firmware."
      },
      {
        "title": "Flash the device",
        "description": "Connect reTerminal Sticky through USB and flash the firmware."
      }
    ]
  }
}
